ANIMALIA,CHORDATA,REPTILIA,SQUAMATA,LACERTIDAE,Iberolacerta,martinezricai,,"This species was formerly treated as a subspecies of Iberolacerta monticola, but genetic and morphological data support a full specific rank (Mayer and Arribas 2003; Arribas and Carranza 2004; Crochet et al. 2004). It was formerly included in the genus Lacerta, but is now included in Iberolacerta, following Carranza et al. (2004), and based on evidence from Arribas (1998, 1999), Carranza et al. (2004), Harris et al. (1998) and Mayer and Arribas (2003).",Yes,Yes,CR,B2ab(v); C2a(ii),CR,B2ab(v); C2a(ii),"Listed as Critically Endangered because its Area of Occupancy is probably less than 10km2, all individuals are in a single sub-population, and there is a continuing decline in the number of mature individuals; and because its population size is estimated to number fewer than 250 mature individuals, with no sub-population greater than 50 individuals, and it is experiencing a continuing decline.",Decreasing,"This species is endemic to Sierra de Francia, Salamanca in Spain at between 800 (Batuecas) and 1,723m asl (Peña deFrancia). The main population is at the peak of the mountain, with some observations from nearby at lower elevations.",It is a very rare species that is in decline. Its population is probably less than 100 mature individuals. Probably 90% of the population is at the peak of the mountain.,"It lives in rocky habitats at high altitudes in temperate forest. If its breeding is similar to that of Iberolacerta cyreni, the females lay a clutch of three to ten eggs once or twice a year.","It is threatened by the collection of specimens, the construction of roads, the use of all-terrain vehicles and the effects of seasonal tourism. It might be affected in the future by climate change.","It occurs in the Parque Natural de las Batuecas y Sierra de Francia, but specific management for the recovery of this species is required. A full-scale recovery programme should be developed, which should probably include captive breeding as part of the overall strategy.","Valentin Pérez-Mellado, Rafael Marquez, Iñigo Martínez-Solano"
ANIMALIA,CHORDATA,REPTILIA,SQUAMATA,COLUBRIDAE,Hemorrhois,nummifer,,"This species is included in Hemorrhois, rather than Coluber, following Nagy et al. (2004).",,,LC,,LC,,"Listed as Least Concern in view of its wide distribution, presumed large population, and because it is unlikely to be declining fast enough to qualify for listing in a more threatened category.Turkey: LC",Unknown,"This species ranges from the Aegean islands of Greece (including Leros, Rhodos, Symi, Kalymnos, Kos, Lipsi and Megisti Kastelorizo), to Cyprus, western and southern Turkey, southwards into Syria, Lebanon, northern and central Israel and western and northwestern Jordan. It also extends eastwards into northeastern Iran, Armenia, northern Iraq, Turkmenistan, Uzbekistan, eastern Kazakhstan, Tajikistan and Kyrgyzstan. There are isolated populations in northern Egypt (close to Cairo and the southern Sinai Peninsula). It is largely a lowland species, but can be found up to around 2,000m asl in Turkey.",It is generally a very common species. In Egypt it is a rare species.,"This species is found in open areas, including open dry woodland and shrubland, with some rocks and bushy vegetation. It is adaptable and can be found in both rural and urban areas. The females lay clutches of four to 10 eggs.",This species is frequently killed by people as it resembles a viper. In Egypt it is also threatened by collection for the pet trade and may be threatened by general habitat degradation through overgrazing of its habitat.,It is found in many protected areas. It is protected by national legislation in Israel. There is a need to develop national legislation to protect this species in Egypt. It is considered to be Vulnerable in Egypt (S. Baha El Din. pers. comm.).,"Aram Agasyan, Aziz Avisi, Boris Tuniyev, Petro Lymberakis, Claes Andrén, Dan Cogalniceanu, John Wilkinson, Natalia Ananjeva, Nazan Üzüm, Nikolai Orlov, Richard Podloucky, Sako Tuniyev, Uğur Kaya, Varol Tok, Ishmail Ugurtas, Murat Sevinç, Souad Hraoui-Bloquet, Riyad Sadek, Pierre-André Crochet, Ahmad Mohammed Mousa Disi, Yehudah Werner, Sherif Baha El Din"
ANIMALIA,CHORDATA,REPTILIA,SQUAMATA,LACERTIDAE,Iberolacerta,monticola,,"Iberolacerta cyreni and Iberolacerta martinezricai are now separated as distinct species from Iberolacerta monticola (Mayer and Arribas 1996) and mitochondrial DNA (Mayer and Arribas 2003; Carranza et al. 2004a; Crochet et al. 2004). This species was formerly included in the genus Lacerta, but is now included in Iberolacerta, following Carranza et al. (2004), and based on evidence from Arribas (1998, 1999), Carranza et al. (2004), Harris et al. (1998) and Mayer and Arribas (2003). The population in the Montes de León has recently been described as a separate species, Iberolacerta galani (Arribas et al. 2006).",Yes,Yes,VU,B1ab(iii),VU,B1ab(iii),"Listed as Vulnerable because its Extent of Occurrence is less than 20,000 km2, its distribution is severely fragmented, and there is continuing decline in the extent and quality of its habitat.",Decreasing,"This species is present in the Cantabrian Mountains and in Galicia in northwestern Spain, and in the Serra da Estrela in central Portugal. Its populations are severely fragmented. It ranges from sea-level in Galicia to 2,000m asl.","It can occur at high densities where the habitat is suitable, but it is very localized. Some populations are in decline.","In most places, this is a mountainous species often found close to the tree-line in damp habitats, where it can be found in areas of scrub and boulders. In Galicia it also occurs in lowland forest close to the sea, sometimes close to streams. The females lay three to ten eggs in a clutch and may have one to three clutches annually.","The populations of this species are highly fragmented and threatened by habitat loss due to agriculture, silviculture and tourism. Populations in Galicia have been declining through the habitat loss to fire, and the loss of suitable rocky areas.","This species is listed on Annex II of the Bern Convention, and it occurs in a number of protected areas in the Cantabrian Mountains. It occurs in the Serra da Estrela Natural Park in Portugal. The development of an action plan has begun in Portugal.","Valentin Pérez-Mellado, Paulo Sá-Sousa, Rafael Marquez, Iñigo Martínez-Solano"
ANIMALIA,CHORDATA,REPTILIA,SQUAMATA,LACERTIDAE,Gallotia,bravoana,,"Following the ruling of the International Commission on Zoological Nomenclature, the name of this species is Gallotia bravoana, not Gallotia gomerana.",Yes,Yes,CR,D,CR,D,"Listed as Critically Endangered because its population size is estimated to number fewer than 50 mature individuals, its populations are severely fragmented, and although it is no longer experiencing a continuing population decline, it has only been increasing since 2001.",Increasing,"This species, thought to be long extinct, was rediscovered as a living animal in 1999, and is known only from two separate inaccessible cliffs 2 km apart, close to the Valle Gran Rey, in the west of the island of La Gomera in the Canary Islands (Spain). The species is thought to have once ranged throughout much of La Gomera, and the present range is less than one hectare.",The population of this species consists of only 90 wild individuals remaining in the wild. There is a captive population of about 44 animals (in 2004).,This species is once widespread in many habitat types on La Gomera. It is now restricted to dry cliffs with sparse vegetation. The species is generally diurnal and mostly herbivorous. The females lay a single clutch annually of three to seven eggs on average.,"The main threats to this species are predation by feral cats, and rock falls within its restricted range. The species historically declined through overgrazing, hunting, and predation by feral cats and rats.","It is present in the Parque Rural de Valle Gran Rey. The species is protected by international legislation. A captive breeding programme has been established on La Gomera, and a species recovery plan is in place. There is a need to control cat populations in the vicinity of the remaining animals. Further surveys are needed on La Gomera within other isolated areas to determine if any more remnant populations of this species persist. The implementation of education programmes for local people has been recommended.","Jose Antonio Mateo Miras, Valentin Pérez-Mellado, Iñigo Martínez-Solano"
ANIMALIA,CHORDATA,REPTILIA,SQUAMATA,COLUBRIDAE,Zamenis,lineatus,,This species is included in Zamenis following Utiger et al. (2002). It was separated from Z. longissimus by Lenk and Wüster (1999).,Yes,Yes,DD,,DD,,Listed as Data Deficient in view of the absence of information on population status and trends.,Unknown,"This species occurs from central Italy (southern Latium [Corsetti and Romano, in press]) to southernmost Italy including Sicily (but excluding southern Apulia). It ranges from sea level up to 1,600 m asl.",There is little recent information on its abundance.,"It is found in dry, open woodlands and shrubland, field edges, traditionally cultivated land, stone walls and old buildings. It is an oviparous species.","It is threatened by accidental mortality on roads, especially in areas where the species is relatively common. It is also threatened by fragmentation of habitat through intensification of agricultural practices. As with many snakes, this species is generally persecuted by people.","It is listed on Annex III of the Bern Convention, and it is known to occur in some protected areas.","Claudia Corti, Roberto Sindaco, Antonio Romano"
ANIMALIA,CHORDATA,REPTILIA,SQUAMATA,COLUBRIDAE,Dolichophis,caspius,,"This species is included in Dolichophis following Nagy et al. (2004), rather than Hierophis.",,,LC,,LC,,"Listed as Least Concern in view of its wide distribution, presumed large population, and because it is unlikely to be declining fast enough to qualify for listing in a more threatened category.Turkey: LC",Unknown,"This species is present from southern Hungary eastwards to Romania, Moldova, southern Ukraine, southwestern Russia and extreme western Kazakhstan. It also ranges southwards through the Balkans from Croatia (Lastavo Island and eastern parts of continental mainland [Ozimec 2005; Trocsanyi and Schafer, 2008]), Serbia, Montenegro, Macedonia (where it only occurs below 1,500m asl), Albania (where widespread), Greece (absent from the Peloponnese peninsula, but present on many islands including Andros, Tinos, Syros, Kythos, Kea, Serifos, Ikaria, Samos, Chios, Oinousses, Thasos, Samothraki and Limons), Bulgaria, and Turkey (Thrace and central and western Anatolia). Records from Jordan require confirmation and might refer to another species, since they are far outside the known range. This species ranges from sea level to 2,000m asl (Turkey).",It is generally a common species over most of its range.,"It is found in dry areas of open scrubland (macchia) and woodland, steppe and other grassland, rocky hillsides, semi-desert, overgrown areas, vineyards, olive groves, rural gardens, stone walls and ruins. In the North Caucasus it has been recorded from sand dune habitats. This species hibernates in large groups (R. Ajtic pers. comm.). In the Crimea, it emerges from hibernation at the end of March - beginning of April; in Kalmykia it emerges in the second part of March. Winter hibernation starts in middle of September - October (sometimes in first part of November). It is active during the day in spring, and in the hot part of summer it has two peaks of activity. Females lay eggs (6 - 18 eggs in the clutch) from middle of June to the beginning of July, with young appearing in the first part of September.","While there appear to be no major threats to the species, it is often killed by traffic while it is basking on roads. As with many other species it may be particularly vulnerable when it forms aggregations for hibernation. It may be persecuted by people, when they are accidentally revealed during hibernation.","This species is included into the Red Data Book of Kazakhstan (1996) - category 3, in the Red Data Books of Ukraine (1994) - category 2 and Moldavia (2001) as an Endangered species. It has been included in the ""Annotated list of taxa and populations required a special attention to their status in the wildlife"" (Appendix to the Red Data Book of Russian Federation, 2001). This species is listed on Annex III of the Bern Convention, Annex IV of the European Union Habitat and Species Directive, and is protected by national legislation in parts of its range. It is present in many protected areas.","Aram Agasyan, Aziz Avisi, Boris Tuniyev, Jelka Crnobrnja Isailovic, Petro Lymberakis, Claes Andrén, Dan Cogalniceanu, John Wilkinson, Natalia Ananjeva, Nazan Üzüm, Nikolai Orlov, Richard Podloucky, Sako Tuniyev, Uğur Kaya, Wolfgang Böhme, Petros Lymberakis, Rastko Ajtic, Varol Tok, Ishmail Ugurtas, Murat Sevinç, Pierre-André Crochet, Idriz Haxhiu, Bogoljub Sterijovski"
ANIMALIA,CHORDATA,REPTILIA,SQUAMATA,LACERTIDAE,Lacerta,agilis,,"A phylogeographic study of this species based on mtDNA (Kalyabina et al. 2001) identified three groups of populations. Further studies of contact areas are needed to evaluate the taxonomic status of these three lineages (Crochet and Dubois 2004). Ten subspecies forms are recognized. The nominative subspecies, L. a. agilis is distributed in Western Europe and western Central Europe; L. a. argus Laurenti, 1758 inhabits Central Europe, east to the Carpathian Mountains and to eastern Poland; L. a. chersonensis Andrzejowski, 1832 - Moldavia, right-bank Ukraine, Belarus, the Baltic States, Leningrad region and south of the neighbouring Karelia. In the east, approximately from the left-bank valley of the river Dnieper a narrow area of intergradation with the neighbouring eastern subspecies is noted; L. a. bosnica Schreiber, 1912 occurs in the mountains of Croatia, Macedonia, Bulgaria and Greece; L. a. exigua Eichwald, 1831 occupies the whole eastern part of the distribution range up to the Crimean Peninsula and Ciscaucasia in the south; L. a. grusinica Peters, 1960 inhabits the coast of the Black Sea and submountane regions of the Caucasus in the south-west of the Krasnodar Territory, Abkhazia, in the Colchic lowland and Ajaria; L. a. brevicaudata Peters, 1958 occurs in northern and western Armenia, southern Georgia and on the southern slopes of the Great Caucasus range within the North Ossetia; L. a. iorensis Peters and Muskhelishwili, 1968 occurs on the southern slopes of the Caucasus range: in the valley and ravine of the upper current of the river Iori in Georgia; L. a. boemica Suchow, 1929 inhabits submontane regions of North Ossetia, Ingushetia, Chechnya and Dagestan; L. a. tauridica Suchow, 1926 inhabits the southern mountains of Crimea.",,,LC,,LC,,"Listed as Least Concern in view of its very wide distribution, tolerance of a degree of habitat modification in some parts of its range, presumed large population, and although it is declining in parts of its range, overall it is unlikely to be declining fast enough (30% or more) to qualify for listing in a more threatened category at the global level. However numerous subpopulations are threatened across the range of the species.Turkey: LC (marginal)",Decreasing,"This species ranges from northeastern Spain (isolated populations in the Pyrenees at around 1,800m asl), France, the United Kingdom (isolated and fragmented populations in the south and the northwest), and southern Scandinavia (throughout Denmark and with a patchy distribution in central and southern Sweden), eastwards through Western, Central and Eastern Europe (where it is patchily distributed) into the Caucasus Mountains, Central Asia and Eastern Asia, as far east as northwestern China and northwestern Mongolia. In Europe it ranges south to the Italian Alps (a very few populations in southwestern and northestern Alps only), northern and eastern Albania and northern Greece (where populations are largely isolated in mountain ranges). It occurs up to at least 2,500m asl (Bulgaria).","It can be common in suitable habitat. It is locally declining in across its NW range (Benedikt Schmidt pers. comm.). In Sweden occurs along the southern coast in continuous populations, inland populations are tiny (5-10 individuals) and relictual.","It can be found in meadows, heathland, coastal dunes, grassland, steppe, subalpine and alpine meadows, shrubland, hedgerows, open woodland, in alpine areas, traditionally managed agricultural land and rural gardens. Sometimes it is present in sandy semi-desert areas. In the northwest of its range (e.g.. UK) it is largely restricted to open heathland and coastal dune habitats. The female may lay one or two clutches of between four and 14 eggs per year. Incubation period lasts 50 - 55 days.","It is threatened by habitat loss through urbanization, conversion to intensive agricultural use (especially the loss of hedgerows and other suitable habitats), coastal and alpine tourism development and the loss of traditional forestry practices, and unsustainable management. Many animals are killed on roads in parts of its range (e.g.. Austria). Some populations in Sweden are reported to be suffering from inbreeding depression due to a fragmented distribution (Olsson et al., 1996). There is some predation of animals by cats in urban areas. Open habitats, which this species requires, are being overgrown with vegetation. It is a threatened species in much of the northwest of its range, including the United Kingdom, Scandinavia and northern Germany.","The species is included into the Red Data Books of numerous countries in the western part of its range. It is listed on Appendix II of the Bern Convention, and on Annex IV of the European Union Habitat and Species Directive. It is protected by national legislation in most of its range countries (all EU). This species is categorized as Vulnerable in Switzerland (Monney and Meyer, 2005). It is present in a number of protected areas over much of its range. Habitat restoration projects (e.g.. Estonia) and reintroductions for the species (e.g.. UK) are taking place in parts of its range.","Aram Agasyan, Aziz Avisi, Boris Tuniyev, Petro Lymberakis, Claes Andrén, Dan Cogalniceanu, John Wilkinson, Natalia Ananjeva, Nazan Üzüm, Nikolai Orlov, Richard Podloucky, Sako Tuniyev, Uğur Kaya, Jelka Crnobrnja Isailovic, Milan Vogrin, Claudia Corti, Valentin Pérez Mellado, Paulo Sá-Sousa, Marc Cheylan, Juan Pleguezuelos, Martin Kyek, Alexander Westerström, Hans Konrad Nettmann, Bartosz Borczyk, Bogoljub Sterijovski, Benedikt Schmidt"
ANIMALIA,CHORDATA,REPTILIA,SQUAMATA,AGAMIDAE,Phrynocephalus,guttatus,,"The nominate subspecies P. g. guttatus  is found within most European and Asian parts of the range. The subspecies P. g. kuschakewitschi Bedriaga In Nikolsky, 1905 is found to the south of the Balkhash Lake (Kazakhstan), and might represent a distinct species. The validity of the western subspecies P. g. kalmykys Badmamayeva and Szczerbak, 1983, is uncertain and it is often considered to be a junior synonym of P. g. guttatus. The subspecific status of the P. guttatus populations recorded from Jungar Gates and Alakol Hollow (Kazakhstan) is unclear.",,,LC,,NE,,"Listed as Least Concern in view of its wide distribution, presumed large population, and because it is unlikely to be declining fast enough to qualify for listing in a more threatened category.",Decreasing,"This species is widely distributed from western borders of China across the whole northern sub-zone of deserts to the western coast of the Caspian Sea. In the European part of Russia, the species is distributed in Dagestan, Kalmykia, Stavropol Territory, Astrakhan and Volgograd region. The main part of the distribution range is situated in Kazakhstan, but the species also occurs also in Uzbekistan (Kara-Kalpakia) and Turkmenistan. It is found up to 1,000m asl.",It is common species found at relatively high densities. It can be a rare species in the Caucasus.,"This species is generally associated with areas of sandy soil, sometimes with a sparse vegetation cover. The subspecies P. g. salsatus is closely associated with alkali soils, but occasionally it can be found on the slopes of barkhans (sand ridges). It is territorial species, females are more settled but have a smaller home range than the male. Reproduction begins at the end of April, with the eggs laid from May to June, and the young appearing in the middle of July.",This species is threatened in lowland parts of its range through the conversion of habitat to intensive agriculture and plantation use.,"In view of its wide range it presumably occurs in some protected areas. The subspecies P. g. salsatus is included into the Red Data Book of Turkmenistan (1999): category 3 - rare, narrow-ranged species.","Boris Tuniyev, Natalia Ananjeva, Aram Agasyan, Nikolai Orlov, Sako Tuniyev, and Steven Anderson"
ANIMALIA,CHORDATA,REPTILIA,SQUAMATA,LACERTIDAE,Lacerta,strigata,,,,,LC,,NE,,"Listed as Least Concern in view of its wide distribution, presumed large population, and because it is unlikely to be declining fast enough to qualify for listing in a more threatened category.",Decreasing,"This species ranges from southern Russia where it occurs in the northeastern Caucasus of Daghestan and Stavropol Territory, through eastern Georgia, Armenia, Azerbajian and northeastern Turkey (vicinity of Mount Ararat, eastern Anatolia), and from the Caspian coast of northern Iran into southwestern Turkmenistan (Baran and Atatur 1998; Anderson 1999). The species may be present in Iraq, although this requires confirmation (Anderson 1999). There is an isolated record of this lizard from Shiraz in southeastern Iran for which the identity has been confirmed (Anderson 1999). It has been recorded from sea level up to 3,000m asl (Turkey). Until recently an isolated population existed in the area of Cape Pizunda in Abkhazia, Georgia.",Over most of the distribution range it is common or even abundant.,"Populations of this species have been found in areas with rushes, clay semi deserts, lowland and montane steppes, brush, shrubs and similar cover. Animals have been recorded from coastal dunes, hilly areas and pastureland containing some shrubby cover (Anderson 1999). In Turkey it is known from sparsely vegetated steppe plains, or slopes sometimes close to forests (Baran and Atatur 1998). The female lays between six and eleven eggs in a clutch (Baran and Atatur 1998), and lays two clutches each season.",In some places in the Caucasus the species is declining due to general habitat destruction.,"This species occurs in numerous protected areas. Other than general research activities, no direct conservation measures are currently needed for the species as a whole.","Boris Tuniyev, Natalia Ananjeva, Aram Agasyan, Nikolai Orlov, Sako Tuniyev, and Steven Anderson"
ANIMALIA,CHORDATA,REPTILIA,SQUAMATA,VIPERIDAE,Montivipera,xanthina,,This species is included in Montivipera following Nilson et al. (1999) and Lenk et al. (2001).,,,LC,,LC,,"Global: LCTurkish: LCEurope: LCEU 27: LCListed as Least Concern in view of its wide distribution, large population, and because it is unlikely to be declining fast enough to qualify for listing in a more threatened category.",Stable,"This species is found in northeastern Greece and in Turkey (western, southern and central Anatolia). In Greece it is also present on the islands of Lesbos, Chios, Samos, Patmos, Leipsoi, Leros, Kalymnos, Kos, Symi, Chalki and Oenousses. It ranges from sea level up to 2,000m asl.",It can be common in upland areas and on islands.,"This species is found in Mediterranean scrubland and mountain steppe habitats. It can be found in rural gardens, cultivated land, olive groves and among ruins. The females give birth to between two and 15 young.","A number populations in western Anatolia, Turkey, appear to be threatened by overcollection for the pet trade. There is some illegal export of this species from Turkey. There is some localized persecution of this species.","This species is listed on Annex II of the Bern Convention. It is listed on Annex IV of the EU Habitats Directive. It is present in many protected areas in southeast Anatolia, Turkey and in Greece as well.","Wolfgang Böhme, Petros Lymberakis, Varol Tok, Ishmail Ugurtas, Murat Sevinç, Pierre-André Crochet, Yakup Kaska, Yusuf Kumlutaş, Aziz Avci, Nazan Üzüm, Can Yeniyurt, Ferdi Akarsu"
