ANIMALIA,CHORDATA,REPTILIA,SQUAMATA,VIPERIDAE,Vipera,berus,,Preliminary data on the phylogeography of the species based on mtDNA sequences identified several independent evolutionary lineages (Joger et al. 2003; Carlsson et al. 2004).,Yes,,LC,,LC,,"Listed as Least Concern in view of its wide distribution, tolerance of a broad range of habitats, presumed large population, and because it is unlikely to be declining fast enough (30% or greater) to qualify for listing in a more threatened category at the global level.",Decreasing,"This widespread species ranges southwards from Scandinavia (where the species is patchily distributed in the northern part of the range) and the Baltic region to France and the United Kingdom (not present in Ireland), and eastwards through Europe (excluding Iberia, peninsular Italy and most of Greece) to Russia (as far east as Sakhalin), Mongolia, the People's Democratic Republic of Korea and northwestern China.  On the Balkan peninsula it is largely restricted to montane areas and has a very fragmented distribution. It has been recorded from sea-level up to 2,700m asl (the Alps and in Bulgaria).[[ASIAN DISTRIBUTION NOT YET MAPPED]]","It can be common in suitable habitat. In some mountainous parts of its range, such as Bulgaria and Greece, it is a rare species (Alexander Westerström pers. comm.). In Germany there have been population declines and some local extinctions. Lowland populations from Po plain in northern Italy are extinct in the past century.","It is present in a wide variety of habitats including, open woodland and shrubland, hedgerows, field edges, heathland, moors, grasslands, alpine meadows, dunes and marshes. It generally requires humid habitats. The female produces between three and 18 young.","In Europe, populations of this species have been significantly fragmented by the intensification of agricultural methods and development. Populations of this species are susceptible to persecution and collection for the pet trade (Ursenbacher, 1997). It is threatened in Romania by illegal collection of animals for venom extraction (CoE, 2003). In some parts of its range afforestation, and succession as a result of abandonment of traditional agricultural practices, are threats.","This species is listed on Annex III of the Bern Convention. It occurs in many protected areas throughout its range. It is protected by national legislation in parts of its range. There is a need to conserve separate evolutionary lineages of this species, as some may represent currently unrecognized species. This species is categorized as Endangered in Switzerland (Monney and Meyer, 2005).","Jelka Crnobrnja Isailovic, Milan Vogrin, Claudia Corti, Paulo Sá-Sousa, Marc Cheylan, Juan Pleguezuelos, Ljiljana Tomović, Bogoljub Sterijovski, Ulrich Joger, A. Westerström, B. Borczyk, Benedikt Schmidt, Andreas Meyer, Robert Sindaco, Dušan Jelić"
ANIMALIA,CHORDATA,REPTILIA,SQUAMATA,LACERTIDAE,Archaeolacerta,bedriagae,,"This species is traditionally included in the genus Lacerta, but it is not closely related to Lacerta sensu stricto (Arnold 1989; Fu 1998, 2000, Harris et al. 1998, Carranza et al. 2004). As it is the type species of Archaeolacerta, this genus is available for it (following Arribas (1998), Mayer and Arribas (2003) and Crochet and Dubois [2004]). This species is the only representative of Archaeolacerta. There are three recognized subspecies: the nominate in Corsica, A.b. sardoa from central Sardinia, and A.b. paessleri in northern Sardinia (perhaps a synonym of sardoa), but their validity seems not confirmed by genetic studies (M. Bologna in litt.).",Yes,Yes,NT,,NT,,"Archaeolacerta bedragae is listed as Near Threatened. Its Extent of Occurrence is less than 20,000 km2; on Sardinia its distribution is severely fragmented and there is continuing decline in the extent and quality of its forest habitat, but on Corsica it is not considered to be severely fragmented or declining.",Decreasing,"This species occurs in rocky areas on the islands of Corsica (France) and Sardinia (Italy) where it has a very fragmented range. In Sardinia it has a very fragmented range. On these two large islands it occurs mainly from 550 to 2,550 m asl, but there are a few coastal populations, including in northern Sardinia and western and southern Corsica. It occurs on several smaller islands, including Foloca Island (France), the Maddalena Archipelago and the Isola Rossa di Trinita' d'Agulto (Italy). On smaller islands it occurs down to sea-level.","This species can be common at higher altitudes, especially in Corsica. At lower elevations and in Sardinia it occurs in very small areas, although large populations can be found locally.","This is typically a rock dwelling lizard, living on cliffs and open rocky areas (e.g. sparsely vegetated islets). It is also found in open woodland and scrubland. It can occur in semi-shaded areas close to streams. The females lay three to six eggs.",Populations in the lowlands of Corsica are vulnerable because of the genetic isolation of many populations. Populations on both islands are threatened by the development of the tourist industry. Sardinian subspecies are vulnerable because they are severely fragmented and have an extremely small area of occupancy.,"Populations in Sardinia may be more sensitive to the threats and populations are strictly protected. This species is listed on Annex III of the Bern Convention, Annex IV of the EC Habitats Directive, and is protected by national and regional legislation in both countries. It occurs in several protected areas.","Claudia Corti, Marc Cheylan, Roberto Sindaco, Antonio Romano, Patrick Haffner"
ANIMALIA,CHORDATA,REPTILIA,SQUAMATA,LACERTIDAE,Gallotia,stehlini,,,Yes,Yes,LC,,LC,,"Listed as Least Concern because, although its Extent of Occurrence is less than 5,000 km2, it is common, occurs in habitats that are not significantly threatened, and does not appear to be in decline.",Stable,"This species is endemic to the island of Gran Canaria in the Canary Islands of Spain. There are additional introduced populations of the species on Fuerteventura. There are also records of introduced animals from Gomera and La Palma, but it is not clear that these represent established populations, and so they are not mapped. It is present from sea level to over 1,850m asl.",It is an abundant species.,"This species is present in a wide variety of habitats. It occurs in open areas, shrubland, rocky humid gorges. The species is absent from forested areas. In Fuerteventura it is found in agricultural areas. It is an egg-laying species.","Although this species is generally still abundant, it is impacted by predation by feral cats and rats.",This species is protected by international legislation. It is occurs in a number of protected areas.,"Jose Antonio Mateo Miras, Valentin Pérez-Mellado, Iñigo Martínez-Solano"
ANIMALIA,CHORDATA,REPTILIA,SQUAMATA,COLUBRIDAE,Elaphe,quatuorlineata,,"Elaphe sauromates was separated from E. quatuorlineata on the basis of a large genetic divergence and clear morphological differences (Lenk et al., 2001).",Yes,,NT,,NT,,"Listed as Near Threatened because this species is probably in significant decline (but probably at a rate of less than 30% over twelve years [generation time 4-5 years]) because of widespread habitat loss through very much of its range, thus making the species close to qualifying for Vulnerable.",Decreasing,"This species is present in Mediterranean and sub-Mediterranean zones in much of central and southern Italy (excluding Sicily), and in the Balkan region, ranging from Slovenia southwards along the Adriatic coastline (including some Adriatic islands), into much of Albania, Macedonia (mainly in the lowlands), southernmost Serbia, Montenegro and Greece (not in Thrace, but on a number of Ionian and Aegean islands). It is found from sea level up to 2,500m asl.","It is not a common species, and it has a fragmented range. It is thought to be in significant decline.","It is found in hedgerows, close to woodland edges, in open woodland, rocky overgrown areas and traditionally cultivated land. Animals may also be found near to waterbodies but also away from them. Animals tend to have very large home ranges. The females lay between four and 16 eggs, and the generation time is 4 to 5 years.",It is mainly threatened by habitat loss due to intensification of agricultural practices and infrastructure development for tourism and urbanization. It is persecuted by humans in many parts of its range.,It is listed on Annex II of the Bern Convention. It occurs in some protected areas throughout its range.,"Jelka Crnobrnja Isailovic, Rastko Atjic, Milan Vogrin, Claudia Corti, Valentin Pérez Mellado, Paulo Sá-Sousa, Marc Cheylan, Juan Pleguezuelos, Petros Lymberakis, Roberto Sindaco, Antonio Romano, Dušan Jelić"
ANIMALIA,CHORDATA,REPTILIA,SQUAMATA,GEKKONIDAE,Alsophylax,pipiens,,,,,NA,,NE,,"Listed as Least Concern in view of its wide distribution, presumed large population, it occurs in a number of protected areas, and because it is unlikely to be declining fast enough to qualify for listing in a more threatened category.",Decreasing,"This species is present over much of Middle Asia. It has been recorded from southern Russia (in Astrakhan west of the Volga River), central and southern Kazakhstan, northwestern Uzbekistan, northern Turkmenistan, northwestern China and central and southern Mongolia (Szczerbak and Golubev 1996). This species is not believed to be present in Iran (Anderson 1999). It is uncertain if the species is present in Afghanistan. It can occur up to 1,550m asl.",It is very common under tones in northwestern China and Kazakhstan. It is a common species that can reach densities of up to 10 individuals per 1 m2 (Szczerbak and Golubev 1996).,"It is found in semi-desert habitats and steppe which has semi-desert areas. It is generally found on slopes, which are covered with large and small rocks, also in areas of weathered rock slabs and less often on clay plains. It has also been recorded from loose sand dunes (Natalia Ananjeva and Nikolai Orlov pers. comm., September, 2008). Vegetation cover is mostly scanty grasses and herbs (Szczerbak and Golubev 1996). The female lays clutches of one or two eggs.","There are no major threats to this widespread species as a whole. The population at the type locality of this species on Mount Bolshoi Bogdo, Astrakhan, Russia, is being lost through quarrying of rock for gravel production (Szczerbak and Golubev 1996).","The species is present in many protected areas. Szczerbak and Golubev (1996), suggest that the populations on Mount Bolshoi Bogdo and in Turkmenistan are in need of protection.","Natalia Ananjeva, Nikolai Orlov, Theodore Papenfuss, Göran Nilson"
ANIMALIA,CHORDATA,REPTILIA,SQUAMATA,GEKKONIDAE,Hemidactylus,turcicus,,"Specimens from India, Pakistan, Arabian Peninsula, Iran, Sudan, Somalia and Kenya are now referable to H. robustus (S. Baha El Din 2006; Bauer et al. 2006).",,,LC,,LC,,"Listed as Least Concern in view of its wide distribution, tolerance of extensive habitat modification, presumed large population, and because it is unlikely to be declining fast enough to qualify for listing in a more threatened category.EU27: LCEU: LCTurkey: LC",Increasing,"This species is widely distributed around the Mediterranean Basin, east through West Asia as far as India, often in built-up areas. In mainland Europe it is found in southwestern Portugal, southern and eastern Spain, southern France, much of coastal Italy, and coastal Slovenia, Croatia, Bosnia-Herzegovina, southern Montenegro, southeast to western Albania and most of Greece. It is found on numerous islands in the Mediterranean, including the Balearic Islands, Corsica, Sardinia, Sicily, Malta, Crete and Cyprus, and many smaller islands in the Tyrrhenian, Adriatic and Aegean Seas.  In mainland Asia it is found in western and southern Turkey (coastal zones, as far inland as Afyon, with an isolated population at Samsun on the north coast), western Syria, Lebanon, Israel and western Jordan. On mainland Africa it is found from northern Morocco through northern Algeria, much of Tunisia, northern Libya, northern and eastern Egypt (including some offshore islands) and the Nile Valley. It was most likely introduced in antiquity through much of its supposedly native range, but it is no longer clear when and where these introductions took place. In more recent times, it has been widely introduced, with introduced populations known from the Canary Islands (Spain), the southern United States, parts of Mexico, Panama, Puerto Rico, Cuba and possibly Belize [not mapped here]. This is a lowland species that is occasionally found up to 1,100m asl. Arabian populations are now referred to H. robustus.",It is abundant over much of its distribution and its range and population is increasing.,"It is extremely adaptable species. It is found in shrubland, rocky areas, salt marshes, coastal areas, cliffs, caves, on stone walls in agricultural areas and it is common in urban environments, including inside buildings. The females lay two to three clutches per year of one to two eggs.","There are no major threats to this very adaptable species. Animals are occasionally persecuted in tourist resorts, and there is some collection of the species for the pet trade, although this does not seem to have a significant impact on the overall population.","It is listed on Annex III of the Bern Convention and is present in a number of protected areas. Further taxonomic studies on this species are needed, particularly for populations in the eastern and Arabian parts of its range (S. Baha El Din pers. comm.).","Aram Agasyan, Aziz Avisi, Boris Tuniyev, Jelka Crnobrnja Isailovic, Petro Lymberakis, Claes Andrén, Dan Cogalniceanu, John Wilkinson, Natalia Ananjeva, Nazan Üzüm, Nikolai Orlov, Richard Podloucky, Sako Tuniyev, Uğur Kaya, Milan Vogrin, Claudia Corti, Valentin Pérez Mellado, Paulo Sá-Sousa, Marc Cheylan, Juan Pleguezuelos, Sherif Baha El Din, C. Varol Tok"
ANIMALIA,CHORDATA,REPTILIA,SQUAMATA,SCINCIDAE,Chalcides,parallelus,,,,,NA,,NA,,"Listed as Endangered because its Extent of Occurrence is less than 5,000 km2, its distribution is severely fragmented, and there is continuing decline in the extent and quality of its coastal habitat.",Decreasing,This species occurs along a narrow coastal strip of approximately 250km between Nador in northeastern Morocco and Cape Carbón in northwestern Algeria. It is also present on the Chafarinas Archipelago (Spain). It is found from sea level to 30m asl.,It is not an abundant species and is thought to be rare along its narrow coastal range.,"This coastal species occurs in sandy areas, overgrown dunes with Mediterranean vegetation and pine and Eucalyptus plantations. This species can be found among and under stones. It is not known to exist in modified habitats. Females give birth to fully formed young.","Development of coastal areas for tourism and military purposes are major threats to this species. It is possibly threatened by loss of ground cover habitat, such as the collection of driftwood by local people for firewood.",It occurs in Chafarine Hunting Reserve in Spain and in the Sebkha Bou Areg and Embouchure Moulouya protected areas in Morocco.,"Philippe Geniez, Jose Antonio Mateo Miras, Ulrich Joger, Juan Pleguezuelos, Tahar Slimani, El Hassan El Mouden, Iñigo Martínez-Solano"
ANIMALIA,CHORDATA,REPTILIA,SQUAMATA,LACERTIDAE,Podarcis,pityusensis,,,Yes,Yes,NT,,NT,,"Listed as Near Threatened because although the species appears not to be in overall decline, its Extent of Occurrence is much less than 5,000 km2, and there are potential future threats, thus making the species close to qualifying for Vulnerable.",Stable,"This species is endemic to the islands of Ibiza and Formentera, and nearby rocky islets, in the Balearic Islands of Spain. It is known from 42 different populations. It has been introduced to Muella de Palma (Mallorca), Barcelona (where now extinct), Aleria town (southern Spain) and San Juan de Gaztelugatxe (northern Spain). It ranges from sea level up to 475 m asl.","It can be common, especially on small islets. A few populations are declining, but overall it is stable.","This species is largely found in vegetated areas, such as cultivated land and gardens, close to and around human habitation. It also occurs in rocky areas, especially in coastal regions. The females lay between one and four eggs.","In general there are no major threats to this species. A number of islet populations are threatened by disturbance by visitors, introduction of cats and rats to the islands, and accidental poisoning with bait left for seagulls.",This species is listed on Annex II of the Bern Convention and on Appendix II of CITES. A public education programme is in place with posters on the small islands. It occurs in some protected areas.,"Valentin Pérez-Mellado, Iñigo Martínez-Solano"
ANIMALIA,CHORDATA,REPTILIA,SQUAMATA,SCINCIDAE,Chalcides,striatus,,,Yes,Yes,LC,,LC,,"Listed as Least Concern in view of its wide distribution, presumed large population, and because it is unlikely to be declining fast enough to qualify for listing in a more threatened category.",Decreasing,"This species is found in fragmented populations in Portugal and Spain (it appears to be absent from much of eastern Spain), southern France and extreme northwestern Italy (Liguria). It occurs on several islands in northwestern Spain. There is an isolated population near Bordeaux in western France. It can be found from sea level up to 1,800m asl.","It is a very common species in some places. Extremely isolated, and hence threatened, populations occurs in southeastern Spain and Liguria (Italy).","This species is found in sunny meadows, grassland, pastureland, open shrubland, hedges and open abandoned cultivated land. It western parts of its range it is also present in drier scrubby and coastal areas. The females give birth to one to twelve fully formed young.","It is threatened by intensification of agriculture, afforestation with pine trees and the abandonment of traditional meadows (resulting in scrub encroachment). Global warming is considered to be a threat for the southernmost populations (Juan M Pleguezuelos pers. comm., October 2008).This species is persecuted in parts of its range as it is mistakenly believed to be poisonous. Populations of this species are often fragmented by unsuitable habitat.",It is listed on the Bern Convention and it occurs in many protected areas.,"Juan Pleguezuelos, Paulo Sá-Sousa, Valentin Pérez-Mellado, Rafael Marquez, Marc Cheylan, Iñigo Martínez-Solano, Roberto Sindaco, Antonio Romano"
ANIMALIA,CHORDATA,REPTILIA,SQUAMATA,LACERTIDAE,Iberolacerta,aurelioi,,"This taxon is now considered to be a full species based on evidence from Arribas (2001), Crochet et al. (2004), Mayer and Arribas (1996, 2003) and Odierna et al. (1996). It was formerly included in the genus Lacerta, but is now included in Iberolacerta, following Carranza et al. (2004), and based on evidence from Arribas (1998, 1999), Carranza et al. (2004), Harris et al. (1998) and Mayer and Arribas (2003).",Yes,Yes,EN,,EN,,"Listed as Endangered because its Extent of Occurrence is less than 5,000 km2 and its Area Of Occupancy is less than 500 km2, its distribution is severely fragmented, and there is continuing decline projected in the extent and quality of its habitat.",Decreasing,"This species is found in the Pyrenees Mountains. It is restricted a small part of the border area of Andorra, France and Spain with the majority of the population found in Spain. It is found from 2,100 to 2,940 m asl.",Most populations are small and consist of tens or a few hundreds of individuals.,"This species is found in rocky areas in alpine regions. It is generally associated with south-facing, glaciated valleys. It is an egg-laying species.","This species is possibly threatened by overgrazing of habitat by cattle, collection of specimens, and is inferred to be threatened by future habitat loss through the development of ski resorts, lodges and hotels, the construction of roads and tracks, and the use of all terrain vehicles. It is additionally threatened by the possible development of hydroelectric projects and mining. It is possible that this species will be significantly impacted by climate change.",This species is listed on Appendix III of the Bern Convention. It does not occur in any protected areas.,"Valentin Pérez-Mellado, Marc Cheylan, Iñigo Martínez-Solano"
ANIMALIA,CHORDATA,REPTILIA,SQUAMATA,VIPERIDAE,Macrovipera,schweizeri,,,Yes,Yes,EN,"B1ab(iii,v)",EN,"B1ab(iii,v)","Listed as Endangered because its Extent of Occurrence is not much greater than 100km2, it is known from only four small islands, there is continuing decline in the extent and quality of its habitat. The population trend may now have more or less stabilized, but this is a recent change and could easily be reversed.",Stable,"This species is endemic to the western Cyclade Islands (Milos, Syphnos, Kimolos and Polyaigos) of Greece. It is found from sea level up to 400m asl (the highest point on the islands).","The population probably totals around 3,000 individuals, with about 2,500 of these on western Milos. Subspecies syphnoensis (from island of Syphnos) is very rare, with only occasional specimens recorded. The population is now more or less stable, but over the last 30-40 years there have been significant declines as a result of collecting and road kills.","It can be found throughout the islands on dry, sunny hillsides and in traditionally cultivated land, in densely vegetated areas close to water with rocky outcrops, and also in pools of water. Its most important habitat is small creeks. The female lays a clutch of between four and 11 eggs.","It is threatened by illegal collection of animals, direct persecution when encountered, accidental mortality on roads and ongoing habitat loss through mining and quarrying concessions. Illegal collection, mortality and mining are still ongoing, but at a lower level than before as a result of regulation and conservation measures. Fires (caused by humans) and tourist development are also important threats. In the species' stronghold in western Milos there are tourist developments causing habitat loss and increased shortage of water.","It is listed on Annex II of the Bern Convention and is protected by national legislation. The entire island of Polyaigos is protected and southern Milos is also protected by the European network of protected areas. The species has been monitored for many years. Snake tunnels have been constructed at four sites, and more are planned; studies have showed that these are an effective method to reduce road kills in this species. Agreements have been reached with the mining company to reduce road traffic, especially at night.","Wolfgang Böhme, Petros Lymberakis, Claes Andrén"
ANIMALIA,CHORDATA,REPTILIA,SQUAMATA,LACERTIDAE,Podarcis,tiliguerta,,"Although the generic epithet Podarcis is masculine  (Böhme 1997; Böhme 1998), tiliguerta is a noun (meaning ""lizard"" in the local Sardinian language) and therefore it is not conjugated. This taxon possibly consists of at least two separate species, one on Sardinia and one on Corsica (C. Corti pers. comm.).",Yes,Yes,LC,,LC,,"Listed as Least Concern in view of its relatively wide distribution, presumed large population, and because it is unlikely to be declining fast enough to qualify for listing in a more threatened category.",Unknown,"This species is restricted to the islands of Corsica (France) and Sardinia (Italy), and on most of the adjacent smaller islands. It occurs from sea level to over 1,800 m asl.","The species is locally abundant, chiefly in mountainous areas, but there is some evidence that it might be locally decreasing. It may be abundant on small islands.","This species is found in arid scrubland, maquis, rocky areas, scree, open woodland, field edges, sandy coastal places with vegetation and occasionally in traditionally cultivated fields. The females lay clutches of six to 12 eggs.","The species is not threatened as a whole, but insular populations are potentially threatened by introduction of predators or overcollection. Podarcis siculus (probably introduced in Sardinia in historical times) perhaps out competes this species when the habitat is opened for agricultural land and pastoral land. It is probably also affected by fire and land-use change.",This species is listed on Appendix II of the Bern Convention and Annex IV of the EU Habitats Directive and is protected by national legislation in France and Italy. It occurs in several protected areas.,"Marc Cheylan, Claudia Corti, Roberto Sindaco, Antonio Romano"
