ANIMALIA,CHORDATA,AMPHIBIA,ANURA,RANIDAE,Rana,dalmatina,,,,,LC,,LC,,"Turkish: LCListed as Least Concern in view of its wide distribution, presumed large population, and because it is unlikely to be declining fast enough to qualify for listing in a more threatened category.",Decreasing,"This species is widely distributed in much of Europe and northern Turkey. Within Europe it is widespread, but it is restricted to Álava, Burgos and Navarra Provinces in Spain, the southeast coastline of Sweden and the islands of Denmark, and it is absent from Portugal, the British Isles (except the island of Jersey, where a small population is present). In addition, there is a need to confirm the presence of this species in Poland, where it is supposed to occur in the southeast. In the former Soviet Union, it is known only from the Transcarpathian Plain (including adjacent foothills and mountain slopes) of the Ukraine. In Turkey this species is found in Turkish Thrace and northern parts of Anatolia; further studies are needed to determine the distributions of Rana dalmatina and Rana macrocnemis along the southern Black Sea coastline. It occurs from sea level to elevations approaching 1,700m asl.","It is a relatively abundant species. The species is common in much of central and eastern Europe (e.g.. Hungary and Romania). In Turkey it is patchily distributed. It is scarce to uncommon in northern Europe (e.g.. Sweden, Denmark). In Spain, it is extremely rare.","It is found in glades and open sites within light deciduous woodland (oak, beech, hornbeam etc.), and less frequent in meadows and thickets. It generally it does not occur in pasture, arable areas or coniferous forests. In Spain the species is restricted to Quercus pedunculata oak forest, and is associated with wet meadows. It spawns in small wetlands (pools, fens and marshes, ditches) within forests and at their edges. High levels of larval mortality have been recorded.","It is generally threatened by the drainage and eutrophication of breeding sites, development (and logging) of suitable habitat, and replacement of deciduous forest habitat with unsuitable coniferous species. It is locally threatened by road mortality during breeding migrations. Grossenbacher (in Krone et al. , 1997) reported skin diseases (possibly associated with viral infection) in populations from Switzerland and northern Italy that are potentially related to declines and may be related to polluted water. It is experiencing localized declines in southwestern Europe.","It is listed on Appendix II the Bern Convention and on Appendix IV of the EU Habitats Directive. This species is protected by national legislation in many countries and is recorded in several national and sub-national Red Data books and lists. It is present in many protected areas. Further research into the distribution limits of this species in Turkey is needed. Conservation initiatives involving head-starting have been undertaken for the small Jersey population which have been remarkably successful. In parts of its range, mitigation measures to reduce road kill have been established. In Spain, it is an endangered species and there are habitat restoration and population monitoring efforts ongoing. In some parts of its range, there have been successful efforts to restore pond habitats.","Uğur Kaya, Sergius Kuzmin, Max Sparreboom, Ismail Ugurtas, David Tarkhnishvili, Steven Anderson, Franco Andreone, Claudia Corti, Per Nyström, Benedikt Schmidt, Brandon Anthony, Agnieszka Ogrodowczyk, Maria Ogielska, Jaime Bosch, Miguel Tejedo"
ANIMALIA,CHORDATA,AMPHIBIA,CAUDATA,PLETHODONTIDAE,Speleomantes,flavus,,,Yes,Yes,VU,D2,VU,D2,"Listed as Vulnerable because it occurs in fewer than five locations, and it is plausible that the species could move into a higher threat category with any increased level of threat.",Stable,"This species is endemic to the Monte Albo chain of north-eastern Sardinia (Italy). It has been collected between 40m and 1,050m asl.",It is locally common within its limited range; there are no reports of any major declines.,"The species is found in damp mountain regions, rocky outcrops, caves, crevices, and forested areas in the vicinity of streams. The preferred habitat often has a good covering of damp moss. It reproduces through the direct development of a few terrestrial eggs.","There are no threats identified other than some localized loss of habitat and illegal collection. However, these threats are limited, and it is not believed to be significantly threatened.","The species is listed on Appendix II of the Bern Convention and on Annex IV of the EU Natural Directive. It has been recorded from the Parco Geominerario, Storico ed Ambientale della Sardegna. There is a need for close monitoring of the population status of this species.","Roberta Lecis, Franco Andreone, Paul Edgar, Claudia Corti, Roberto Sindaco, Antonio Romano"
ANIMALIA,CHORDATA,AMPHIBIA,ANURA,RANIDAE,Pelophylax,perezi,,,Yes,Yes,LC,,LC,,"Listed as Least Concern in view of its wide distribution, tolerance of a broad range of habitats, presumed large population, and because it is unlikely to be declining fast enough to qualify for listing in a more threatened category.",Stable,"This species is found in southern France and across the whole of the Iberian Peninsula. It has been introduced to the Balearic Islands, and the Canary Islands (Spain), two sites in the United Kingdom (Sheppey, Kent and Newdigate, Surrey) and Madeira and the Azores (Portugal) (the distribution in the Azores requires further details and is incompletely mapped here). It occurs from sea level up to 2,380m asl (Sierra Nevada, Spain).","It is generally widespread and common over much of the Iberian Peninsula, while populations in France are reported to be scarce and dispersed (Gasc et al. , 1997). This species appears to be expanding its range to higher elevations, possibly as a result of climate change.","It inhabits a wide variety of temporary and permanent waterbodies (pools, streams, ditches, irrigation canals etc.). The terrestrial habitats of the species include forests, Mediterranean-type scrub, agricultural areas, rocky areas, coastal marshes, gardens and urban parks. It breeds in various aquatic habitats, and is able to tolerate some habitat disturbance.","There are generally no major threats to this widespread species. localized threats include changes in habitat through the loss of traditional agricultural methods, drainage or pollution of wetlands, collection of individuals for human consumption and hybridization with introduced farmed European ranids (R. esculenta complex). Mortality of the species through disease (iridovirus) has been recorded in Carris Lake, Peneda-Gerês National Park, Portugal. The disease might be non-native and have been transferred to the lake by an introduced predatory North American fish ( Lepomis gibbosus ). Predation by Lepomis gibbosus and other introduced predatory fish species occurs but is probably not a threat, and it is not greatly threatened in Portugal by the expansion of non-native predatory crayfish (Beja pers. comm.). In France, it is being displaced within some of its range by the introduced species Pelophylax ridibunda .","It is listed on Annex III of the Berne Convention and on Annex V of the EU Natural Habitats Directive. It is recorded in the national Red Data Book of Spain, and several regional Red Data Books. It occurs in many protected areas including Doñana and Cabañeros National Parks in Spain. In Portugal it is present in Peneda-Gerês National Park, where the population of Carris Lake has been impacted by disease. Further research into the impacts of disease on this species is needed.","Jaime Bosch, Miguel Tejedo, Pedro Beja, Iñigo Martínez-Solano, Alfredo Salvador, Mario García-París, Ernesto Recuero Gil, Trevor Beebee"
ANIMALIA,CHORDATA,AMPHIBIA,CAUDATA,SALAMANDRIDAE,Salamandra,atra,,"Four subspecies have been described: Salamandra atra atra ; S. a. aurorae ; S.a. prenjensis ; and S. a. pasobiensis . The status of these subspecies remains questionable. S.a. prenjensis is often not considered to be valid. S.a. aurorae has been sometimes considered to be a separate species. Joger (1996), using serum proteins, showed significant differences, and he proposed the elevation of S.a. aurorae to a full species. Veith et al. (1998), analyzing mitDNA of S.a. aurorae did not find any significant difference. Riberon et al. (2001) indicate a complex pattern of divergence for the alpine populations, without reaching or stressing any taxonomic consequences.",Yes,,LC,,LC,,"Listed as Least Concern in view of its wide distribution, tolerance of a degree of habitat modification, presumed large population, and because it is unlikely to be declining fast enough to qualify for listing in a more threatened category.The subspecies Salamandra atra aurorae qualifies for listing as Critically Endangered under criterion B1ab(iii) because its Extent of Occurrence is probably less than 100 km2, all individuals may be in a single location, and there is continuing decline in the quality of its habitat in the Bosco del Dosso.",Decreasing,"This species is present in the European Alps (including a recently discovered population close to the village of Samoëns in the Département de la Haute-Savoie, France), with isolated populations in the Balkan Dinaric Alps in Slovenia, Croatia, Bosnia-Herzegovina, Serbia-Montenegro and northern Albania. It occurs at elevations between 400 and 2800m asl (more frequent between 800-2,000m asl). The subspecies Salamandra atra aurorae is largely restricted to the Bosco del Dosso and Val Rensola in north-east Italy (between 1,300 and 1,800m asl); new localities extending to the east were discovered in the early 1990s (with a distance between furthermost sites of 15km2), and it is possible that this subspecies might occur in the entire forested high plateau of the area. Further field surveys are needed to verify the full distribution of Salamandra atra aurorae.","It is still be abundant in Switzerland (although now considered to be extinct in some southern parts of the country), Germany, Austria and parts of Italy. It appears to be more rare and threatened in the Dinaric Alps in Slovenia, Croatia, Bosnia-Herzegovina, Serbia-Montenegro and northern Albania (e.g., Kalezic and Dzukic, 2001). Gasc et al. (1997) considered Salamandra atra aurorae to be highly endangered.","It is found in cool, damp alpine meadows, stony pastures, dwarf heath and mixed, broadleaf and coniferous woodland. Animals are usually hidden below stones and logs, but can be encountered in shady places, or after rain, during the day. The species is unusual in that it has a ovi-viviparous method of reproduction by which it gives birth on land to an average of two fully metamorphosed offspring; the gestation period is between two and four years. It may be found in pastureland and other slightly modified habitats. It is not associated with water.","There are generally no threats to the Italian populations of S.a. atra. Some local populations in Switzerland are threatened by road mortality and populations of the Dinaric Alps are threatened by localized habitat destruction through intensification of farming methods, tourism (skiing) and infrastructure development. The subspecies S.a. aurorae is threatened by collection for scientific purposes and the pet trade and general habitat alteration through excessive water abstraction from streams, and the removal of ground cover during forestry practices. Populations in Serbia and Montenegro are small, fragmented and threatened by over-collecting for the pet trade and possibly climatic changes."," Salamandra atra is listed on Appendix II of the Bern Convention and Salamandra atra aurorae is listed on Annex II* of the EU Habitats Directive under the name ' Salamandra salamandra aurorae '; both Salamandra atra and ' Salamandra aurorae '[sic] are also listed on Annex IV of the Directive. The species is protected by national legislation in most range countries (e.g.. Switzerland, Slovenia) and it is present in a number of protected areas. Kalezic and Dzukic (2001) suggest the establishment of a protected area on Prokletije Mount would significantly aid the conservation of S. atra in the Dinaric Alps. The subspecies S. a. aurorae is present in the Natura 2000 sites of Cima Dodici (10,450 ha) and Pasubo e Piccole Dolomiti: Monte Pasubo (1,920 ha).","Franco Andreone, Mathieu Denoël, Claude Miaud, Benedikt Schmidt, Paul Edgar, Milan Vogrin, Jelka Crnobrnja Isailovic, Rastko Ajtic, Claudia Corti, Idriz Haxhiu"
ANIMALIA,CHORDATA,AMPHIBIA,ANURA,RANIDAE,Pelophylax,bedriagae,,This species was previously considered to be a subspecies of Pelophylax ridibundus . The taxonomy and distribution of this species and other West Asian water frogs needs further research. The taxonomic status of populations on Cyprus should also be reviewed as these animals might represent a species endemic to that island (Wolfgang Böhme pers. comm.).,,,LC,,LC,,"Global: LCTurkish: LCEurope: LCEU 27: LCListed as Least Concern in view of its wide distribution, its tolerance of a broad range of habitats, its presumed large population, and because it is unlikely to be declining fast enough to qualify for listing in a more threatened category.In Turkey, this species is listed as Least Concern in view of its wide distribution, its tolerance of a broad range of habitats, its presumed large population, and because it is unlikely to be declining fast enough to qualify for listing in a more threatened category. Trade of the species if continued at unsustainable levels could endanger the species.In Europe and EU27, this species is listed as Least Concern in view of its wide distribution, its tolerance of a broad range of habitats, its presumed large population, and because it is unlikely to be declining fast enough to qualify for listing in a more threatened category. The species could be threatened by competition with humans for limited water resources on small islands.",Decreasing,"This species ranges widely in the eastern Mediterranean. In Turkey this species is widespread along the Aegean coast and the southern part of the Anatolian highlands. It is also found on the Greek islands close to the coast of Turkey including the island of Rhodes (Arnold, 2002), and ranges through much of Cyprus. It is present in eastern Syrian Arab Republic (with isolated populations in the north and east), most of Lebanon (where it is a common species), northeastern Jordan (with an isolated population known from the Azraq Oasis), Lebanon (a common species), much of Israel (except the extreme south), and Egypt (Nile Delta and northeastern Sinai (Disi et al. , 2001; S. Baha El Din pers. comm.). It might range more widely, and records from Iraq (not mapped) require confirmation; this will be determined by ongoing taxonomic work. In Jordan the species has been collected from sea level to 1,500m asl.","It is generally common to abundant in humid areas. In Lebanon it is very abundant in the lowlands and is also common at higher elevations. It is common, but localized in Egypt (S. Baha El Din pers. comm.).","This is a largely aquatic species of permanent wetlands with rich aquatic vegetation. The species' habitats include permanent ponds, rain pools, streams, rivers, irrigation channels, reservoirs, marshes, springs and fishponds, being sometimes found in surrounding terrestrial habitats. It is able to survive in areas with organic pollution and tributaries from hot mineral springs. It is a seasonal breeder, with breeding taking place in permanent waterbodies. This species can occur in modified habitats where suitable wetlands exist.","It is threatened by a localized loss of habitat through the drainage of wetlands, pollution, excessive drought and the development of coastal areas. It is caught and exported from Turkey to western Europe for food which represents a significant threat. It is exported in large numbers from Egypt (S. Baha El Din pers. comm.). There are no threats to the species in Lebanon. On the smaller islands in Greece where this species is present, it is sometimes threatened by water abstraction by local people.","Further surveys are needed to accurately determine this species range. It is protected by national legislation in Israel, and it is present in the Azraq Wetland Reserve, Dana Wildlife Reserve and Al Maujib Wildlife Reserves of Jordan and the Arz El-Shouf, Horj Ehden, Ammiq marshes and Sandy Beach of Sour protected areas in Lebanon. It is found several protected areas in Turkey.","Theodore Papenfuss, Sergius Kuzmin, Ahmad Disi, Gad Degani, Ismail Ugurtas, Max Sparreboom, Steven Anderson, Riyad Sadek, Souad Hraoui-Bloquet, Avital Gasith, Eldad Elron, Sarig Gafny, Petros Lymberakis, Wolfgang Böhme, Sherif Baha El Din,"
ANIMALIA,CHORDATA,AMPHIBIA,ANURA,RANIDAE,Pelophylax,esculentus,,"Previously, Pelophylax esculentus was considered to be a full species or a subspecies. It has since been found to be a hybrid form between the parental species, P. lessonae and P. ridibundus . According to the generally accepted view, this is a kleptospecies, i.e. a new category of taxa at the species level, the character of which does not coincide with the biological species concept. A large majority of past records of "" Rana esculenta "" (except for the designation of P. ridibundus under the same name) refer to P. lessonae or the latter and the hybrid form together. Further studies on the ecology and distribution of the hybrid P. esculentus are needed.",Yes,,LC,,LC,,"Listed as Least Concern in view of its wide distribution, tolerance of a broad range of habitats, presumed large population, and because it is unlikely to be declining fast enough to qualify for listing in a more threatened category.",Decreasing,"This species ranges throughout most of western, central and eastern Europe; populations are largely sympatric with populations of the parental species. It is absent from much of Scandinavia (although present in Denmark and southern most Sweden [it is unclear as to whether or not the Swedish populations are relicts or introductions]). In Italy it is present only with certainty in the River Po plain. The species has been introduced to the United Kingdom [not mapped here] and to Spain at Villasbuenas de Gata, Cáceres and unspecified localities in Galicia, Cataluña and Comunidad Valenciana. It is generally a lowland taxon which might occur up to approximately 1,550m asl.",It is generally stable with large populations in Eastern Europe. There have been population declines reported in parts of Western Europe.,"It is a largely aquatic species associated with wetlands such as ponds, channels, ditches and slow moving rivers and streams. It is generally absent from forests, very large pools and strongly flowing waterbodies. The species spawns and larval development takes place within wetland habitats. It can occur in artificial waterbodies, and has spread in parts of its range through the irrigation of formerly unsuitable habitat (e.g.. in parts of Romania).","It is generally threatened by aquatic pollution (often by agrochemicals) and drainage of wetland habitats. The frog-leg trade and high levels of pollution are leading to significant declines in populations of the former Yugoslavia (Dzukic, 1996; Ljubisavljevic et al. 2003). Declines in the parent species R. lessonae can directly affect dependant populations of R. esculenta .","It is listed on Annex V of the EU Natural Habitats Directive and is protected by national legislation in many countries. It is recorded on many national and sub-national Red Data books and lists. It is present in many protected areas. In parts of this species' range, mitigation measures to reduce road kill have been established.","Sergius Kuzmin, Trevor Beebee, Franco Andreone, Brandon Anthony, Benedikt Schmidt, Agnieszka Ogrodowczyk, Vladimir Ishchenko, Natalia Ananjeva, Nikolai Orlov, Boris Tuniyev, Maria Ogielska, Claude Miaud, Jon Loman, Dan Cogalniceanu, Tibor Kovács"
ANIMALIA,CHORDATA,AMPHIBIA,CAUDATA,SALAMANDRIDAE,Calotriton,asper,,We follow Carranza and Amat (2005) in transferring this species from Euproctus to the genus Calotriton .,Yes,Yes,NT,,NT,,"Listed as Near Threatened because its Extent of Occurrence is probably not much greater than 20,000 km2, and its habitat is in decline, thus making the species close to qualifying for Vulnerable.",Decreasing,"This species is found throughout much of the Pyrenean mountain range of France and Spain, where it occurs at a wide range of altitudes from 175m to over 3,000m asl (on the northern slopes of the Pyrenees), although the average range is 700-2,500m asl. It has recently been found in the Corbieres Mountains, 20km south-east of Carcassonne, in south-eastern France, which represents a range extension northwards.","It is abundant or common in parts of its restricted range, although several peripheral populations have disappeared largely through loss of habitat. It is more common in the west of its range.","It is a largely aquatic montane species that inhabits cold mountain lakes, torrents, streams, and occasionally cave systems, that are ice-free for at least four months of the year (Griffiths 1996). The eggs are deposited individually under rocks and stones in well-oxygenated, cold streams with rocky bottoms, and the larvae then develop in these streams. This species has a small clutch size of 20-40 eggs (Griffiths 1996).","The main threats to this species are loss and damage of its aquatic habitats. Infrastructure development and tourism lead to over-exploitation of water resources, including from skiing facilities. The introduction of predatory trout (salmonids) and other fish is also a threat, leading to population extinctions, especially in mountain lakes. Pesticides are readily accumulated in the body tissues of this largely insectivorous species, and several populations demonstrate contamination by these chemicals (Gasc et al. (eds.) 1997). It is considered likely to be vulnerable to climate change."," It has been recorded from Parque Nacional de Ordesa y Monte Perdido and Parque Nacional de Aigües Tortes y Lago San Mauricio, Spain, and presumably occurs in several other protected areas. It is listed on Appendix II of the Bern Convention and on Annex IV of the EU Habitats Directive, and it is protected by national legislation in Spain.","Jaime Bosch, Miguel Tejedo, Roberta Lecis, Claude Miaud, Miguel Lizana, Paul Edgar, Iñigo Martínez-Solano, Alfredo Salvador, Mario García-París, Ernesto Recuero Gil, Rafael Marquez, Philippe Geniez"
ANIMALIA,CHORDATA,AMPHIBIA,CAUDATA,SALAMANDRIDAE,Lissotriton,vulgaris,,Further taxonomic studies are required on this species. Numerous subspecies exist.,,,LC,,LC,,"Listed as Least Concern in view of its wide distribution, tolerance of a broad range of habitats, presumed large population, and because it is unlikely to be declining fast enough to qualify for listing in a more threatened category.Turkey: LC",Stable,"This species is widespread through most of Europe (with the exception of the Iberian Peninsula from which it is absent). It ranges from Ireland and Great Britain, through west and central Europe and Scandinavia, south to Italy, the Balkans and northern and western Turkey, and east through much of the steppes of Ukraine and Russia. There is an isolated population in the Caucasus. The species occurs at elevations from sea level up to 2,150m asl (Austria).",It is very common or numerous over much of its range.,"It is generally associated with woodland habitats, including deciduous, coniferous, mixed forests and dry forests and woodlands. This is an adaptable species also present in meadows, bushlands, parks, fruit gardens, many damp habitats and rural and urban areas. The species breeds in still and slow moving shallow waters and irrigation ditches; females lay 200-300 eggs. It is often recorded from modified habitats. Several hybrids with L. helveticus have been reported while hybridization with L. montandoni is quite common in syntopic populations","There are no major threats to this species. localized threats to the species include general drainage, pollution and eutrophication of breeding sites, logging of forest surrounding breeding pools and the introduction of predatory fishes. In the former Soviet Union there is mass commercial collecting of this species for the pet trade. Within Turkey, construction and building along the Black Sea coastline might be impacting northern Turkish populations.",It is presumed to occur in numerous protected areas. It is listed in a number of Red Data Books and Lists and is both listed on Appendix III of the Berne Convention and protected by national legislation in parts of its range. In parts of this species range mitigation measures to reduce road kill have been established. Several of the recognized subspecies may qualify for a higher threat listing and should be assessed in the future following taxonomic clarification.,"Jan Willem Arntzen, Sergius Kuzmin, Trevor Beebee, Theodore Papenfuss, Max Sparreboom, Ismail Ugurtas, Steven Anderson, Brandon Anthony, Franco Andreone, David Tarkhnishvili, Vladimir Ishchenko, Natalia Ananjeva, Nikolai Orlov, Boris Tuniyev"
